{"authoring_digest":"eb8c45c4940b50833f6f3e8d0ba6330a95c1e029e4ea6c36b86c9a2b6b5b91cd","review_digest":"872e3b1d12d1c2ac02a46db9dfd3de2c188bcb04489dacc7d5103212d6e00d20","schema":"lattice.plan_scope_review.v1","task_assessments":[{"judgment":"required","reason":"companion plan登録とrepair前提edgeの原子登録というPLANの単一利用者機能をそのまま実装する。","task_id":"companion-atomic-repair-edge","work_spec_ids":["companion-atomic-repair-edge"]},{"judgment":"required","reason":"conversation時のpull前提案内というPLANの利用者機能をそのまま実装する。","task_id":"ldr-02-conversation-pull-guidance","work_spec_ids":["ldr-02-conversation-pull-guidance"]},{"judgment":"required","reason":"worker holdとAI制御面の分離というPLANの利用者機能をそのまま実装する。","task_id":"ldr-03-worker-control-separation","work_spec_ids":["ldr-03-worker-control-separation"]},{"judgment":"required","reason":"隔離clean基準からのbinding作成というPLANの利用者機能をそのまま実装する。","task_id":"ldr-04-isolated-clean-binding","work_spec_ids":["ldr-04-isolated-clean-binding"]},{"judgment":"required","reason":"完了済みsourceのcross-plan前提記録というPLANの利用者機能をそのまま実装する。","task_id":"ldr-05-satisfied-cross-plan-prerequisite","work_spec_ids":["ldr-05-satisfied-cross-plan-prerequisite"]},{"judgment":"required","reason":"companion planの必要入力取得と新規起票というPLANの利用者機能をそのまま実装する。","task_id":"ldr-06-companion-input-scaffold","work_spec_ids":["ldr-06-companion-input-scaffold"]},{"judgment":"required","reason":"todo migrateの--json受理統一というPLANの利用者機能をそのまま実装する。","task_id":"ldr-10-migrate-json-consistency","work_spec_ids":["ldr-10-migrate-json-consistency"]},{"judgment":"required","reason":"structure artifactのtyped診断と既存writerによるcanonical復旧というPLANの単一利用者機能をそのまま実装する。","task_id":"structure-artifact-canonical-repair","work_spec_ids":["structure-artifact-canonical-repair"]}],"verdict":"scope_preserved","work_specs":[{"acceptance":"起票直後は未完了repairがtargetの前提として表示され、repair完了後はtargetがreadyへ戻る。失敗時はplanもedgeも残らず、結果からrepair、target、接続後frontier、次の操作を確認できる。","requirement":"companion plan入力、repair task、対象task、理由を一度指定し、plan登録とrepairからtargetへのhard dependencyを一つのtyped操作として原子登録する。既存task同士への後付け接続も同じ入口で扱う。","work_spec_id":"companion-atomic-repair-edge"},{"acceptance":"conversation調整だけでpull可能だと案内せず、不足物とartifact準備操作または別の実行方法を公開CLIのtyped next actionから辿れる。","requirement":"coordination_mode=conversationを選んだ場合でも、pull設備に必要なindependence artifactと次の操作を実行前に分かるようにする。","work_spec_id":"ldr-02-conversation-pull-guidance"},{"acceptance":"holdがworkerへ作用している間もAI processはrecoveryを読み、状況報告と回復操作を行える。Latticeはtask選択、会話、席管理を所有しない。","requirement":"hold対象workerとAIの会話・制御processを分け、worker停止中もAIが回復操作を続けられるようにする。","work_spec_id":"ldr-03-worker-control-separation"},{"acceptance":"無関係WIP commitを不要にしてisolated clean基準からbindingを作れ、後段にlanding監視を追加しない。","requirement":"共有mainの無関係なWIPをcommitせず、隔離されたclean基準からindependence bindingを作れるようにする。","work_spec_id":"ldr-04-isolated-clean-binding"},{"acceptance":"完了済みsourceと未完了targetを指定すると既存完了記録を使って前提を記録し、targetを不必要にblockしない。専用証拠台帳や完了状態の不変化機構を作らない。","requirement":"完了済みtaskを後から既に満たされたcross-plan前提として記録する。","work_spec_id":"ldr-05-satisfied-cross-plan-prerequisite"},{"acceptance":"AIが計画文書、source inventory、extractionを一から手組みする量が減り、Latticeは目的、工程分割、依存を推測・生成しない。","requirement":"companion campaign起票時に公開CLIから必要入力を取得し、既存planを部分変更せず新planとして起票できるようにする。","work_spec_id":"ldr-06-companion-input-scaffold"},{"acceptance":"通常実行、dry-run、schemaで--jsonの扱いが反転せず、既存のversioned JSON出力を維持する。","requirement":"typed JSONを返すtodo migrateで--jsonの受理を一貫させる。","work_spec_id":"ldr-10-migrate-json-consistency"},{"acceptance":"pretty JSON、trailing bytes、truncated JSON、schema invalidでgeneric成功を返さず、plan、path、reason、次のstructure input commandを返す。適用時は指定planの対象artifactだけをcanonical 1-line+LFへ書き直す。","requirement":"壊れたstructure artifactをstatusとverifyでtyped診断し、明示したlogical input refから既存structure input writerでcanonical復旧できるようにする。","work_spec_id":"structure-artifact-canonical-repair"}]}
